<company xmlns:xsi="http://www.w3.org/2001/XMLSchema-instance"
 xsi:noNamespaceSchemaLocation="company.xsd" Multinacional="NO" Currency="Euro">
    <generalInfo>
        <name>XML Technologies</name>
        <numberOfEmployees>6</numberOfEmployees>
        <sector><technology/></sector>
    </generalInfo>
    <DepStaff date="2023-03-02">
        <employers>
            <employee code="ADMIN" DepName="Administration" user="atorres">
                <nameAndSurname>Alicia Torres Pan</nameAndSurname>
                <role>head of department</role>
                <sickLeave>NO</sickLeave>
                <salary>2250.00</salary>
                <key>3%abYki6</key>
            </employee>
            <employee code="ADMIN" DepName="Administration" user="xaldrei">
                <nameAndSurname>Xoán Aldrei Soto</nameAndSurname>
                <role>Employee</role>
                <sickLeave>YES</sickLeave>
                <salary>1200.00</salary>
                <key>6@hjKm87</key>
            </employee>
            <employee code="ADMIN" DepName="Administration" user="amotar">
                <nameAndSurname>Ana Mota Rei</nameAndSurname>
                <role>Employee</role>
                <sickLeave>NO</sickLeave>
                <salary>1250.50</salary>
                <key>4%wtrtHQ</key>
            </employee>
            <employee code="COMPU" DepName="Computer" user="obaltar">
                <nameAndSurname>Óscar Baltar Dacosta</nameAndSurname>
                <role>Head of department</role>
                <sickLeave>YES</sickLeave>
                <salary>2300.75</salary>
                <key>8$abcdHj
                </key>
            </employee>
            <employee code="COMPU" DepName="Computer" user="hvilar">
                <nameAndSurname>Helena Vilar Moure</nameAndSurname>
                <role>Employee</role>
                <sickLeave>NO</sickLeave>
                <salary>1500.35</salary>
                <key>9?sdKp:s</key>
            </employee>
            <employee code="MARKE" DepName="Marketing" user="guest">
                <nameAndSurname>Andrea Serodio Paz</nameAndSurname>
                <role>Head of department</role>
                <sickLeave>NO</sickLeave>
                <salary>2500.85</salary>
                <key>2$xlzhYH</key>
            </employee>
        </employers>
    </DepStaff>
</company>